{
  "assessment_id": "6cf03dda3db22c82af8f2a57c331e877b60aa1a906474b318e086d02cf5d14d7",
  "changes": null,
  "competencies": [
    {
      "adjustments": [],
      "confidence": "medium",
      "counterevidence_ids": [
        "E-006"
      ],
      "group": "technical",
      "id": "problem_solving",
      "independent_sources": 1,
      "name": "Problem solving",
      "not_observable_reason": null,
      "proposed_score": 3,
      "rationale": "Race-aware claim path; incomplete failure handling counts against it.",
      "score": 3,
      "self_report_ids": [],
      "status": "observed",
      "supporting_evidence_ids": [
        "E-002"
      ]
    },
    {
      "adjustments": [],
      "confidence": "medium",
      "counterevidence_ids": [],
      "group": "technical",
      "id": "code_quality",
      "independent_sources": 1,
      "name": "Code quality",
      "not_observable_reason": null,
      "proposed_score": 3,
      "rationale": "Small, cohesive store with clear error type.",
      "score": 3,
      "self_report_ids": [],
      "status": "observed",
      "supporting_evidence_ids": [
        "E-001",
        "E-002"
      ]
    },
    {
      "adjustments": [
        "E-009 cannot support a score (attribution unlikely, status downgraded)"
      ],
      "confidence": "medium",
      "counterevidence_ids": [],
      "group": "technical",
      "id": "architecture",
      "independent_sources": 3,
      "name": "Architecture",
      "not_observable_reason": null,
      "proposed_score": 4,
      "rationale": "Versioned storage boundary plus a recorded design decision; HTTP module is not the candidate's.",
      "score": 4,
      "self_report_ids": [],
      "status": "observed",
      "supporting_evidence_ids": [
        "E-001",
        "E-004",
        "E-008"
      ]
    },
    {
      "adjustments": [
        "cited E-010 dropped: line_end 130 beyond end of file (48 lines)"
      ],
      "confidence": "medium",
      "counterevidence_ids": [],
      "group": "technical",
      "id": "system_design",
      "independent_sources": 2,
      "name": "System design",
      "not_observable_reason": null,
      "proposed_score": 3,
      "rationale": "Concurrency handled for one process; multi-process limit acknowledged.",
      "score": 3,
      "self_report_ids": [],
      "status": "observed",
      "supporting_evidence_ids": [
        "E-002",
        "E-004"
      ]
    },
    {
      "adjustments": [],
      "confidence": "medium",
      "counterevidence_ids": [
        "E-005"
      ],
      "group": "technical",
      "id": "testing",
      "independent_sources": 1,
      "name": "Testing",
      "not_observable_reason": null,
      "proposed_score": 2,
      "rationale": "CI gate exists but the worker is untested and one test is misnamed.",
      "score": 2,
      "self_report_ids": [],
      "status": "observed",
      "supporting_evidence_ids": [
        "E-007"
      ]
    },
    {
      "adjustments": [],
      "confidence": "low",
      "counterevidence_ids": [],
      "group": "technical",
      "id": "security",
      "independent_sources": 0,
      "name": "Security",
      "not_observable_reason": "no_evidence",
      "proposed_score": null,
      "rationale": "No inspected code crosses a trust boundary.",
      "score": null,
      "self_report_ids": [],
      "status": "not_observable",
      "supporting_evidence_ids": []
    },
    {
      "adjustments": [],
      "confidence": "low",
      "counterevidence_ids": [
        "E-006"
      ],
      "group": "technical",
      "id": "operations",
      "independent_sources": 1,
      "name": "Operations",
      "not_observable_reason": null,
      "proposed_score": 2,
      "rationale": "CI present; failure recovery in the worker is incomplete.",
      "score": 2,
      "self_report_ids": [],
      "status": "observed",
      "supporting_evidence_ids": [
        "E-007"
      ]
    },
    {
      "adjustments": [],
      "confidence": "medium",
      "counterevidence_ids": [],
      "group": "technical",
      "id": "technical_depth",
      "independent_sources": 1,
      "name": "Technical depth",
      "not_observable_reason": null,
      "proposed_score": 3,
      "rationale": "Correct use of SQLite threading and WAL settings.",
      "score": 3,
      "self_report_ids": [],
      "status": "observed",
      "supporting_evidence_ids": [
        "E-003"
      ]
    },
    {
      "adjustments": [],
      "confidence": "medium",
      "counterevidence_ids": [],
      "group": "technical",
      "id": "engineering_judgment",
      "independent_sources": 2,
      "name": "Engineering judgment",
      "not_observable_reason": null,
      "proposed_score": 4,
      "rationale": "Explicit rejected alternative and named revisit trigger; forward-version refusal.",
      "score": 4,
      "self_report_ids": [],
      "status": "observed",
      "supporting_evidence_ids": [
        "E-004",
        "E-001"
      ]
    },
    {
      "adjustments": [],
      "confidence": "low",
      "counterevidence_ids": [],
      "group": "technical",
      "id": "learning",
      "independent_sources": 1,
      "name": "Learning",
      "not_observable_reason": null,
      "proposed_score": 3,
      "rationale": "Iterated the schema through a migration rather than a rewrite.",
      "score": 3,
      "self_report_ids": [],
      "status": "observed",
      "supporting_evidence_ids": [
        "E-008"
      ]
    },
    {
      "adjustments": [],
      "confidence": "medium",
      "counterevidence_ids": [],
      "group": "delivery",
      "id": "ownership",
      "independent_sources": 2,
      "name": "Ownership",
      "not_observable_reason": null,
      "proposed_score": 3,
      "rationale": "Maintains and evolves the store across commits; records lifecycle decisions.",
      "score": 3,
      "self_report_ids": [],
      "status": "observed",
      "supporting_evidence_ids": [
        "E-008",
        "E-004"
      ]
    },
    {
      "adjustments": [],
      "confidence": "low",
      "counterevidence_ids": [],
      "group": "delivery",
      "id": "product_thinking",
      "independent_sources": 0,
      "name": "Product thinking",
      "not_observable_reason": null,
      "proposed_score": 2,
      "rationale": "Problem statement only; no usage or outcome evidence.",
      "score": 2,
      "self_report_ids": [],
      "status": "observed",
      "supporting_evidence_ids": [
        "E-011"
      ]
    },
    {
      "adjustments": [],
      "confidence": "low",
      "counterevidence_ids": [],
      "group": "influence",
      "id": "collaboration",
      "independent_sources": 0,
      "name": "Collaboration",
      "not_observable_reason": "no_evidence",
      "proposed_score": null,
      "rationale": "Another contributor exists, but no reviews or discussions were available offline.",
      "score": null,
      "self_report_ids": [],
      "status": "not_observable",
      "supporting_evidence_ids": []
    },
    {
      "adjustments": [],
      "confidence": "low",
      "counterevidence_ids": [],
      "group": "influence",
      "id": "technical_leadership",
      "independent_sources": 0,
      "name": "Technical leadership",
      "not_observable_reason": "no_evidence",
      "proposed_score": null,
      "rationale": "No standards, mentoring or cross-team artefacts in scope.",
      "score": null,
      "self_report_ids": [],
      "status": "not_observable",
      "supporting_evidence_ids": []
    }
  ],
  "confirmed_weaknesses": [
    {
      "competencies": [
        "operations",
        "problem_solving"
      ],
      "dropped_evidence_ids": [],
      "evidence_ids": [
        "E-006"
      ],
      "summary": "Worker failure recovery is not implemented although documented: jobs that fail stay 'running'."
    },
    {
      "competencies": [
        "testing"
      ],
      "dropped_evidence_ids": [],
      "evidence_ids": [
        "E-005"
      ],
      "summary": "Test suite overstates coverage: the worker path has no test oracle."
    }
  ],
  "contested_evidence": [],
  "coverage": {
    "repositories": [
      {
        "candidate_line_coverage": 0.9573,
        "candidate_lines_inspected": 112,
        "candidate_lines_total": 117,
        "repo": "R1",
        "sample_coverage": 0.6364,
        "sample_items": 11,
        "sample_items_audited": 7,
        "sample_items_inspected": 7
      }
    ]
  },
  "development_plan": [
    {
      "action": "Enforce MAX_ATTEMPTS using the attempts column; move exhausted jobs to a 'failed' state; requeue on transient errors.",
      "category": "confirmed_weakness",
      "competencies": [
        "operations",
        "problem_solving"
      ],
      "effort": "S",
      "horizon_days": 14,
      "id": "P-01",
      "priority": "P1",
      "source_evidence_ids": [
        "E-006"
      ],
      "success_criterion": "A test that injects a failing handler observes attempts == MAX_ATTEMPTS and state == 'failed'.",
      "title": "Make retries real",
      "why": "Failed jobs are stranded in 'running', which silently loses work."
    },
    {
      "action": "Add worker tests for success, handler exception and empty queue; rename or remove test_worker_runs.",
      "category": "confirmed_weakness",
      "competencies": [
        "testing"
      ],
      "effort": "S",
      "horizon_days": 30,
      "id": "P-02",
      "priority": "P1",
      "source_evidence_ids": [
        "E-005",
        "E-007"
      ],
      "success_criterion": "Coverage of worker.py at 100% of branches, enforced in CI.",
      "title": "Test the worker, not just the store",
      "why": "The riskiest path has no oracle and a misleading test name."
    },
    {
      "action": "Review the other contributor's HTTP changes through pull requests and document a contribution guide for the store API.",
      "category": "evidence_gap",
      "competencies": [
        "collaboration",